{
  "certified": true,
  "certifier": "Agent 3 (Certifier) — claude-sonnet-4-6",
  "timestamp": "2026-05-05T19:45:00Z",
  "spec_file": ".boss/spec.md",
  "verification_file": ".boss/verification.md",
  "requirements_total": 30,
  "requirements_passed": 30,
  "requirements_failed": 0,
  "requirements_met": [
    "SPEC-001",
    "SPEC-002",
    "SPEC-003",
    "SPEC-004",
    "SPEC-005",
    "SPEC-006",
    "SPEC-007",
    "SPEC-008",
    "SPEC-009",
    "SPEC-010",
    "SPEC-011",
    "SPEC-012",
    "SPEC-013",
    "SPEC-014",
    "SPEC-015",
    "SPEC-016",
    "SPEC-017",
    "SPEC-018",
    "SPEC-019",
    "SPEC-020",
    "SPEC-021",
    "SPEC-022",
    "SPEC-023",
    "SPEC-024",
    "SPEC-025",
    "SPEC-026",
    "SPEC-027",
    "SPEC-028",
    "SPEC-029",
    "SPEC-030"
  ],
  "gaps": [],
  "proof_artifacts": [
    ".boss/test-results/stdout.txt",
    ".boss/test-results/junit.xml"
  ],
  "certification_notes": "Raw artifacts confirm Agent 2 claims exactly. junit.xml: errors=0, failures=0, skipped=15, tests=63 (48 passed). stdout.txt output matches Agent 2 quoted output verbatim. All 30 SPECs verified PASS. 15 skips are Unix-only bash execution tests (10 TestStopGateSh + 5 pre-build-gate bash tests), expected on Windows platform. No contradictions found between verification.md prose and raw artifacts."
}
